{
  "schema_version": "1.0",
  "frame_id": "carla_000123",
  "risk_level": "medium",
  "reason_codes": ["distance_10_to_25m"],
  "recommended_action": "decelerate",
  "safe_following_distance_m": 20.0,
  "object_assessments": [
    {
      "object_id": "carla_actor_42",
      "relevant_to_ego_path": true,
      "distance_m": 20.0,
      "safe_distance_m": 20.0,
      "distance_is_safe": true,
      "closing_speed_mps": 4.0,
      "ttc_s": 5.0,
      "ttc_risk_level": "none",
      "risk_level": "medium",
      "reason_codes": ["distance_10_to_25m"]
    }
  ],
  "lane_change": {
    "left": {
      "direction": "left",
      "is_safe": true,
      "reason_codes": ["target_lane_clear"],
      "blocking_object_ids": [],
      "closest_front_gap_m": null,
      "closest_rear_gap_m": null
    },
    "right": {
      "direction": "right",
      "is_safe": true,
      "reason_codes": ["target_lane_clear"],
      "blocking_object_ids": [],
      "closest_front_gap_m": null,
      "closest_rear_gap_m": null
    }
  }
}
